tcpdump: verbose output suppressed, use -v[v]... for full protocol decode
listening on eth0, link-type EN10MB (Ethernet), snapshot length 262144 bytes
12:55:36.499283 IP 10.244.7.1.33276 > sravni-apigateway-service-566b9db658-f4d8g.80: Flags [S], seq 2222154868, win 28200, options [mss 1410,sackOK,TS val 2184038591 ecr 0,nop,wscale 7], length 0
12:55:36.499350 IP sravni-apigateway-service-566b9db658-f4d8g.80 > 10.244.7.1.33276: Flags [S.], seq 776731501, ack 2222154869, win 27960, options [mss 1410,sackOK,TS val 2184038591 ecr 2184038591,nop,wscale 7], length 0
12:55:36.499388 IP 10.244.7.1.33276 > sravni-apigateway-service-566b9db658-f4d8g.80: Flags [.], ack 1, win 221, options [nop,nop,TS val 2184038591 ecr 2184038591], length 0
12:55:36.499729 IP 10.244.7.1.33276 > sravni-apigateway-service-566b9db658-f4d8g.80: Flags [P.], seq 1:128, ack 1, win 221, options [nop,nop,TS val 2184038591 ecr 2184038591], length 127: HTTP: GET /internal/health HTTP/1.1
12:55:36.499750 IP sravni-apigateway-service-566b9db658-f4d8g.80 > 10.244.7.1.33276: Flags [.], ack 128, win 219, options [nop,nop,TS val 2184038591 ecr 2184038591], length 0
12:55:36.500918 IP sravni-apigateway-service-566b9db658-f4d8g.80 > 10.244.7.1.33276: Flags [P.], seq 1:252, ack 128, win 219, options [nop,nop,TS val 2184038591 ecr 2184038591], length 251: HTTP: HTTP/1.1 200 OK
12:55:36.500943 IP 10.244.7.1.33276 > sravni-apigateway-service-566b9db658-f4d8g.80: Flags [.], ack 252, win 229, options [nop,nop,TS val 2184038591 ecr 2184038591], length 0
12:55:36.500962 IP sravni-apigateway-service-566b9db658-f4d8g.80 > 10.244.7.1.33276: Flags [P.], seq 252:257, ack 128, win 219, options [nop,nop,TS val 2184038591 ecr 2184038591], length 5: HTTP
12:55:36.500972 IP 10.244.7.1.33276 > sravni-apigateway-service-566b9db658-f4d8g.80: Flags [.], ack 257, win 229, options [nop,nop,TS val 2184038591 ecr 2184038591], length 0
12:55:36.501045 IP 10.244.7.1.33276 > sravni-apigateway-service-566b9db658-f4d8g.80: Flags [F.], seq 128, ack 257, win 229, options [nop,nop,TS val 2184038591 ecr 2184038591], length 0
12:55:36.501227 IP sravni-apigateway-service-566b9db658-f4d8g.80 > 10.244.7.1.33276: Flags [F.], seq 257, ack 129, win 219, options [nop,nop,TS val 2184038591 ecr 2184038591], length 0
12:55:36.501258 IP 10.244.7.1.33276 > sravni-apigateway-service-566b9db658-f4d8g.80: Flags [.], ack 258, win 229, options [nop,nop,TS val 2184038591 ecr 2184038591], length 0
12:55:36.548115 IP sravni-apigateway-service-566b9db658-f4d8g.52662 > kube-dns.kube-system.svc.cluster.local.53: 56080+ PTR? 1.7.244.10.in-addr.arpa. (41)
12:55:36.570676 IP kube-dns.kube-system.svc.cluster.local.53 > sravni-apigateway-service-566b9db658-f4d8g.52662: 56080 NXDomain 0/1/0 (100)
12:55:36.651317 IP sravni-apigateway-service-566b9db658-f4d8g.45852 > kube-dns.kube-system.svc.cluster.local.53: 17303+ PTR? 10.0.96.10.in-addr.arpa. (41)
12:55:36.653015 IP kube-dns.kube-system.svc.cluster.local.53 > sravni-apigateway-service-566b9db658-f4d8g.45852: 17303 1/0/0 PTR kube-dns.kube-system.svc.cluster.local. (93)
12:55:37.654071 IP 10.244.2.170.33714 > sravni-apigateway-service-566b9db658-f4d8g.80: Flags [P.], seq 3159453941:3159454194, ack 4291489237, win 1846, options [nop,nop,TS val 287206624 ecr 2184035133], length 253: HTTP: GET /internal/metrics HTTP/1.1
12:55:37.655469 IP sravni-apigateway-service-566b9db658-f4d8g.44117 > kube-dns.kube-system.svc.cluster.local.53: 64082+ PTR? 170.2.244.10.in-addr.arpa. (43)
12:55:37.663188 IP sravni-apigateway-service-566b9db658-f4d8g.80 > 10.244.2.170.33714: Flags [P.], seq 1:1180, ack 253, win 1421, options [nop,nop,TS val 2184038882 ecr 287206624], length 1179: HTTP: HTTP/1.1 200 OK
12:55:37.663384 IP sravni-apigateway-service-566b9db658-f4d8g.80 > 10.244.2.170.33714: Flags [P.], seq 1180:5471, ack 253, win 1421, options [nop,nop,TS val 2184038882 ecr 287206624], length 4291: HTTP
12:55:37.663451 IP sravni-apigateway-service-566b9db658-f4d8g.80 > 10.244.2.170.33714: Flags [P.], seq 5471:7557, ack 253, win 1421, options [nop,nop,TS val 2184038882 ecr 287206624], length 2086: HTTP
12:55:37.663487 IP sravni-apigateway-service-566b9db658-f4d8g.80 > 10.244.2.170.33714: Flags [P.], seq 7557:9279, ack 253, win 1421, options [nop,nop,TS val 2184038882 ecr 287206624], length 1722: HTTP
12:55:37.663515 IP sravni-apigateway-service-566b9db658-f4d8g.80 > 10.244.2.170.33714: Flags [.], seq 9279:10677, ack 253, win 1421, options [nop,nop,TS val 2184038882 ecr 287206624], length 1398: HTTP
12:55:37.664058 IP 10.244.2.170.33714 > sravni-apigateway-service-566b9db658-f4d8g.80: Flags [.], ack 1180, win 1846, options [nop,nop,TS val 287206626 ecr 2184038882], length 0
12:55:37.664083 IP sravni-apigateway-service-566b9db658-f4d8g.80 > 10.244.2.170.33714: Flags [.], seq 10677:13473, ack 253, win 1421, options [nop,nop,TS val 2184038882 ecr 287206626], length 2796: HTTP
12:55:37.664086 IP 10.244.2.170.33714 > sravni-apigateway-service-566b9db658-f4d8g.80: Flags [.], ack 3976, win 1846, options [nop,nop,TS val 287206626 ecr 2184038882], length 0
12:55:37.664093 IP sravni-apigateway-service-566b9db658-f4d8g.80 > 10.244.2.170.33714: Flags [.], seq 13473:19065, ack 253, win 1421, options [nop,nop,TS val 2184038882 ecr 287206626], length 5592: HTTP
12:55:37.664162 IP 10.244.2.170.33714 > sravni-apigateway-service-566b9db658-f4d8g.80: Flags [.], ack 5471, win 1846, options [nop,nop,TS val 287206626 ecr 2184038882], length 0
12:55:37.664169 IP sravni-apigateway-service-566b9db658-f4d8g.80 > 10.244.2.170.33714: Flags [.], seq 19065:24657, ack 253, win 1421, options [nop,nop,TS val 2184038882 ecr 287206626], length 5592: HTTP
12:55:37.664938 IP 10.244.2.170.33714 > sravni-apigateway-service-566b9db658-f4d8g.80: Flags [.], ack 7557, win 1846, options [nop,nop,TS val 287206626 ecr 2184038882], length 0
12:55:37.664944 IP 10.244.2.170.33714 > sravni-apigateway-service-566b9db658-f4d8g.80: Flags [.], ack 9279, win 1846, options [nop,nop,TS val 287206626 ecr 2184038882], length 0
12:55:37.664953 IP sravni-apigateway-service-566b9db658-f4d8g.80 > 10.244.2.170.33714: Flags [.], seq 24657:35841, ack 253, win 1421, options [nop,nop,TS val 2184038882 ecr 287206626], length 11184: HTTP
12:55:37.664954 IP 10.244.2.170.33714 > sravni-apigateway-service-566b9db658-f4d8g.80: Flags [.], ack 10677, win 1842, options [nop,nop,TS val 287206626 ecr 2184038882], length 0
12:55:37.664995 IP 10.244.2.170.33714 > sravni-apigateway-service-566b9db658-f4d8g.80: Flags [.], ack 13473, win 1825, options [nop,nop,TS val 287206626 ecr 2184038882], length 0
12:55:37.665579 IP 10.244.2.170.33714 > sravni-apigateway-service-566b9db658-f4d8g.80: Flags [.], ack 16269, win 1846, options [nop,nop,TS val 287206627 ecr 2184038882], length 0
12:55:37.665599 IP sravni-apigateway-service-566b9db658-f4d8g.80 > 10.244.2.170.33714: Flags [.], seq 35841:49821, ack 253, win 1421, options [nop,nop,TS val 2184038882 ecr 287206627], length 13980: HTTP
12:55:37.665601 IP 10.244.2.170.33714 > sravni-apigateway-service-566b9db658-f4d8g.80: Flags [.], ack 23259, win 1846, options [nop,nop,TS val 287206627 ecr 2184038882], length 0
12:55:37.665612 IP sravni-apigateway-service-566b9db658-f4d8g.80 > 10.244.2.170.33714: Flags [P.], seq 49821:58293, ack 253, win 1421, options [nop,nop,TS val 2184038882 ecr 287206627], length 8472: HTTP
12:55:37.665614 IP 10.244.2.170.33714 > sravni-apigateway-service-566b9db658-f4d8g.80: Flags [.], ack 24657, win 1846, options [nop,nop,TS val 287206627 ecr 2184038882], length 0
12:55:37.665739 IP sravni-apigateway-service-566b9db658-f4d8g.80 > 10.244.2.170.33714: Flags [P.], seq 58293:58305, ack 253, win 1421, options [nop,nop,TS val 2184038882 ecr 287206627], length 12: HTTP
12:55:37.665861 IP sravni-apigateway-service-566b9db658-f4d8g.80 > 10.244.2.170.33714: Flags [P.], seq 58305:58859, ack 253, win 1421, options [nop,nop,TS val 2184038882 ecr 287206627], length 554: HTTP
12:55:37.665890 IP sravni-apigateway-service-566b9db658-f4d8g.80 > 10.244.2.170.33714: Flags [P.], seq 58859:59796, ack 253, win 1421, options [nop,nop,TS val 2184038882 ecr 287206627], length 937: HTTP
12:55:37.665910 IP sravni-apigateway-service-566b9db658-f4d8g.80 > 10.244.2.170.33714: Flags [P.], seq 59796:60479, ack 253, win 1421, options [nop,nop,TS val 2184038882 ecr 287206627], length 683: HTTP
12:55:37.665928 IP sravni-apigateway-service-566b9db658-f4d8g.80 > 10.244.2.170.33714: Flags [P.], seq 60479:60971, ack 253, win 1421, options [nop,nop,TS val 2184038882 ecr 287206627], length 492: HTTP
12:55:37.667387 IP 10.244.2.170.33714 > sravni-apigateway-service-566b9db658-f4d8g.80: Flags [.], ack 26055, win 1846, options [nop,nop,TS val 287206627 ecr 2184038882], length 0
12:55:37.667408 IP sravni-apigateway-service-566b9db658-f4d8g.80 > 10.244.2.170.33714: Flags [.], seq 60971:63767, ack 253, win 1421, options [nop,nop,TS val 2184038883 ecr 287206627], length 2796: HTTP
12:55:37.667411 IP 10.244.2.170.33714 > sravni-apigateway-service-566b9db658-f4d8g.80: Flags [.], ack 30249, win 1846, options [nop,nop,TS val 287206627 ecr 2184038882], length 0
12:55:37.667416 IP 10.244.2.170.33714 > sravni-apigateway-service-566b9db658-f4d8g.80: Flags [.], ack 35841, win 1846, options [nop,nop,TS val 287206627 ecr 2184038882], length 0
12:55:37.667427 IP sravni-apigateway-service-566b9db658-f4d8g.80 > 10.244.2.170.33714: Flags [P.], seq 63767:77287, ack 253, win 1421, options [nop,nop,TS val 2184038883 ecr 287206627], length 13520: HTTP
12:55:37.667428 IP 10.244.2.170.33714 > sravni-apigateway-service-566b9db658-f4d8g.80: Flags [.], ack 38637, win 1846, options [nop,nop,TS val 287206627 ecr 2184038882], length 0
12:55:37.667432 IP 10.244.2.170.33714 > sravni-apigateway-service-566b9db658-f4d8g.80: Flags [.], ack 42831, win 1846, options [nop,nop,TS val 287206627 ecr 2184038882], length 0
12:55:37.667628 IP 10.244.2.170.33714 > sravni-apigateway-service-566b9db658-f4d8g.80: Flags [.], ack 54015, win 1809, options [nop,nop,TS val 287206627 ecr 2184038882], length 0
12:55:37.667637 IP 10.244.2.170.33714 > sravni-apigateway-service-566b9db658-f4d8g.80: Flags [.], ack 58305, win 1776, options [nop,nop,TS val 287206627 ecr 2184038882], length 0
12:55:37.667803 IP sravni-apigateway-service-566b9db658-f4d8g.80 > 10.244.2.170.33714: Flags [P.], seq 77287:79283, ack 253, win 1421, options [nop,nop,TS val 2184038883 ecr 287206627], length 1996: HTTP
12:55:37.667937 IP sravni-apigateway-service-566b9db658-f4d8g.80 > 10.244.2.170.33714: Flags [P.], seq 79283:81431, ack 253, win 1421, options [nop,nop,TS val 2184038883 ecr 287206627], length 2148: HTTP
12:55:37.668019 IP sravni-apigateway-service-566b9db658-f4d8g.80 > 10.244.2.170.33714: Flags [P.], seq 81431:82665, ack 253, win 1421, options [nop,nop,TS val 2184038883 ecr 287206627], length 1234: HTTP
12:55:37.668073 IP sravni-apigateway-service-566b9db658-f4d8g.80 > 10.244.2.170.33714: Flags [P.], seq 82665:84734, ack 253, win 1421, options [nop,nop,TS val 2184038883 ecr 287206627], length 2069: HTTP
12:55:37.668145 IP sravni-apigateway-service-566b9db658-f4d8g.80 > 10.244.2.170.33714: Flags [P.], seq 84734:86673, ack 253, win 1421, options [nop,nop,TS val 2184038883 ecr 287206627], length 1939: HTTP
12:55:37.668208 IP sravni-apigateway-service-566b9db658-f4d8g.80 > 10.244.2.170.33714: Flags [P.], seq 86673:88797, ack 253, win 1421, options [nop,nop,TS val 2184038883 ecr 287206627], length 2124: HTTP
12:55:37.668271 IP sravni-apigateway-service-566b9db658-f4d8g.80 > 10.244.2.170.33714: Flags [P.], seq 88797:90071, ack 253, win 1421, options [nop,nop,TS val 2184038883 ecr 287206627], length 1274: HTTP
12:55:37.668307 IP sravni-apigateway-service-566b9db658-f4d8g.80 > 10.244.2.170.33714: Flags [P.], seq 90071:90225, ack 253, win 1421, options [nop,nop,TS val 2184038883 ecr 287206627], length 154: HTTP
12:55:37.668353 IP sravni-apigateway-service-566b9db658-f4d8g.80 > 10.244.2.170.33714: Flags [P.], seq 90225:91871, ack 253, win 1421, options [nop,nop,TS val 2184038883 ecr 287206627], length 1646: HTTP
12:55:37.668415 IP sravni-apigateway-service-566b9db658-f4d8g.80 > 10.244.2.170.33714: Flags [P.], seq 91871:94979, ack 253, win 1421, options [nop,nop,TS val 2184038883 ecr 287206627], length 3108: HTTP
12:55:37.668477 IP 10.244.2.170.33714 > sravni-apigateway-service-566b9db658-f4d8g.80: Flags [.], ack 59796, win 1799, options [nop,nop,TS val 287206627 ecr 2184038882], length 0
12:55:37.668483 IP 10.244.2.170.33714 > sravni-apigateway-service-566b9db658-f4d8g.80: Flags [.], ack 60971, win 1846, options [nop,nop,TS val 287206627 ecr 2184038882], length 0
12:55:37.668485 IP 10.244.2.170.33714 > sravni-apigateway-service-566b9db658-f4d8g.80: Flags [.], ack 63767, win 1846, options [nop,nop,TS val 287206627 ecr 2184038883], length 0
12:55:37.668488 IP sravni-apigateway-service-566b9db658-f4d8g.80 > 10.244.2.170.33714: Flags [P.], seq 94979:96616, ack 253, win 1421, options [nop,nop,TS val 2184038883 ecr 287206627], length 1637: HTTP
12:55:37.668544 IP sravni-apigateway-service-566b9db658-f4d8g.80 > 10.244.2.170.33714: Flags [P.], seq 96616:98793, ack 253, win 1421, options [nop,nop,TS val 2184038883 ecr 287206627], length 2177: HTTP
12:55:37.668585 IP sravni-apigateway-service-566b9db658-f4d8g.80 > 10.244.2.170.33714: Flags [P.], seq 98793:100735, ack 253, win 1421, options [nop,nop,TS val 2184038883 ecr 287206627], length 1942: HTTP
12:55:37.668652 IP sravni-apigateway-service-566b9db658-f4d8g.80 > 10.244.2.170.33714: Flags [P.], seq 100735:102819, ack 253, win 1421, options [nop,nop,TS val 2184038883 ecr 287206627], length 2084: HTTP
12:55:37.668697 IP sravni-apigateway-service-566b9db658-f4d8g.80 > 10.244.2.170.33714: Flags [P.], seq 102819:106390, ack 253, win 1421, options [nop,nop,TS val 2184038883 ecr 287206627], length 3571: HTTP
12:55:37.668737 IP sravni-apigateway-service-566b9db658-f4d8g.80 > 10.244.2.170.33714: Flags [P.], seq 106390:106935, ack 253, win 1421, options [nop,nop,TS val 2184038883 ecr 287206627], length 545: HTTP
12:55:37.668979 IP sravni-apigateway-service-566b9db658-f4d8g.80 > 10.244.2.170.33714: Flags [P.], seq 106935:106940, ack 253, win 1421, options [nop,nop,TS val 2184038883 ecr 287206627], length 5: HTTP
12:55:37.671237 IP 10.244.2.170.33714 > sravni-apigateway-service-566b9db658-f4d8g.80: Flags [.], ack 66563, win 1846, options [nop,nop,TS val 287206627 ecr 2184038883], length 0
12:55:37.671272 IP 10.244.2.170.33714 > sravni-apigateway-service-566b9db658-f4d8g.80: Flags [.], ack 69359, win 1846, options [nop,nop,TS val 287206627 ecr 2184038883], length 0
12:55:37.671290 IP 10.244.2.170.33714 > sravni-apigateway-service-566b9db658-f4d8g.80: Flags [.], ack 77287, win 1833, options [nop,nop,TS val 287206628 ecr 2184038883], length 0
12:55:37.671313 IP 10.244.2.170.33714 > sravni-apigateway-service-566b9db658-f4d8g.80: Flags [.], ack 79283, win 1846, options [nop,nop,TS val 287206628 ecr 2184038883], length 0
12:55:37.671342 IP 10.244.2.170.33714 > sravni-apigateway-service-566b9db658-f4d8g.80: Flags [.], ack 81431, win 1846, options [nop,nop,TS val 287206628 ecr 2184038883], length 0
12:55:37.671364 IP 10.244.2.170.33714 > sravni-apigateway-service-566b9db658-f4d8g.80: Flags [.], ack 84734, win 1846, options [nop,nop,TS val 287206628 ecr 2184038883], length 0
12:55:37.671388 IP 10.244.2.170.33714 > sravni-apigateway-service-566b9db658-f4d8g.80: Flags [.], ack 91871, win 1793, options [nop,nop,TS val 287206628 ecr 2184038883], length 0
12:55:37.671531 IP 10.244.2.170.33714 > sravni-apigateway-service-566b9db658-f4d8g.80: Flags [.], ack 94979, win 1846, options [nop,nop,TS val 287206628 ecr 2184038883], length 0
12:55:37.671548 IP 10.244.2.170.33714 > sravni-apigateway-service-566b9db658-f4d8g.80: Flags [.], ack 96616, win 1846, options [nop,nop,TS val 287206628 ecr 2184038883], length 0
12:55:37.671582 IP 10.244.2.170.33714 > sravni-apigateway-service-566b9db658-f4d8g.80: Flags [.], ack 98793, win 1846, options [nop,nop,TS val 287206628 ecr 2184038883], length 0
12:55:37.671741 IP 10.244.2.170.33714 > sravni-apigateway-service-566b9db658-f4d8g.80: Flags [.], ack 106940, win 1791, options [nop,nop,TS val 287206628 ecr 2184038883], length 0
12:55:37.677035 IP kube-dns.kube-system.svc.cluster.local.53 > sravni-apigateway-service-566b9db658-f4d8g.44117: 64082 NXDomain 0/1/0 (102)
12:55:44.880488 IP 10.244.7.1.33418 > sravni-apigateway-service-566b9db658-f4d8g.80: Flags [S], seq 2681822569, win 28200, options [mss 1410,sackOK,TS val 2184040686 ecr 0,nop,wscale 7], length 0
12:55:44.880572 IP sravni-apigateway-service-566b9db658-f4d8g.80 > 10.244.7.1.33418: Flags [S.], seq 1090102764, ack 2681822570, win 27960, options [mss 1410,sackOK,TS val 2184040686 ecr 2184040686,nop,wscale 7], length 0
12:55:44.880634 IP 10.244.7.1.33418 > sravni-apigateway-service-566b9db658-f4d8g.80: Flags [.], ack 1, win 221, options [nop,nop,TS val 2184040686 ecr 2184040686], length 0
12:55:44.881250 IP 10.244.7.1.33418 > sravni-apigateway-service-566b9db658-f4d8g.80: Flags [P.], seq 1:126, ack 1, win 221, options [nop,nop,TS val 2184040686 ecr 2184040686], length 125: HTTP: GET /internal/ping HTTP/1.1
12:55:44.881298 IP sravni-apigateway-service-566b9db658-f4d8g.80 > 10.244.7.1.33418: Flags [.], ack 126, win 219, options [nop,nop,TS val 2184040686 ecr 2184040686], length 0
12:55:44.883280 IP sravni-apigateway-service-566b9db658-f4d8g.80 > 10.244.7.1.33418: Flags [P.], seq 1:243, ack 126, win 219, options [nop,nop,TS val 2184040687 ecr 2184040686], length 242: HTTP: HTTP/1.1 200 OK
12:55:44.883326 IP 10.244.7.1.33418 > sravni-apigateway-service-566b9db658-f4d8g.80: Flags [.], ack 243, win 229, options [nop,nop,TS val 2184040687 ecr 2184040687], length 0
12:55:44.883395 IP sravni-apigateway-service-566b9db658-f4d8g.80 > 10.244.7.1.33418: Flags [F.], seq 243, ack 126, win 219, options [nop,nop,TS val 2184040687 ecr 2184040687], length 0
12:55:44.883621 IP 10.244.7.1.33418 > sravni-apigateway-service-566b9db658-f4d8g.80: Flags [F.], seq 126, ack 244, win 229, options [nop,nop,TS val 2184040687 ecr 2184040687], length 0
12:55:44.883650 IP sravni-apigateway-service-566b9db658-f4d8g.80 > 10.244.7.1.33418: Flags [.], ack 127, win 219, options [nop,nop,TS val 2184040687 ecr 2184040687], length 0
12:55:46.499077 IP 10.244.7.1.33464 > sravni-apigateway-service-566b9db658-f4d8g.80: Flags [S], seq 757367086, win 28200, options [mss 1410,sackOK,TS val 2184041091 ecr 0,nop,wscale 7], length 0
12:55:46.499136 IP sravni-apigateway-service-566b9db658-f4d8g.80 > 10.244.7.1.33464: Flags [S.], seq 901091700, ack 757367087, win 27960, options [mss 1410,sackOK,TS val 2184041091 ecr 2184041091,nop,wscale 7], length 0
12:55:46.499168 IP 10.244.7.1.33464 > sravni-apigateway-service-566b9db658-f4d8g.80: Flags [.], ack 1, win 221, options [nop,nop,TS val 2184041091 ecr 2184041091], length 0
12:55:46.500004 IP 10.244.7.1.33464 > sravni-apigateway-service-566b9db658-f4d8g.80: Flags [P.], seq 1:128, ack 1, win 221, options [nop,nop,TS val 2184041091 ecr 2184041091], length 127: HTTP: GET /internal/health HTTP/1.1
12:55:46.500098 IP sravni-apigateway-service-566b9db658-f4d8g.80 > 10.244.7.1.33464: Flags [.], ack 128, win 219, options [nop,nop,TS val 2184041091 ecr 2184041091], length 0
12:55:46.501220 IP sravni-apigateway-service-566b9db658-f4d8g.80 > 10.244.7.1.33464: Flags [P.], seq 1:252, ack 128, win 219, options [nop,nop,TS val 2184041091 ecr 2184041091], length 251: HTTP: HTTP/1.1 200 OK
12:55:46.501249 IP 10.244.7.1.33464 > sravni-apigateway-service-566b9db658-f4d8g.80: Flags [.], ack 252, win 229, options [nop,nop,TS val 2184041091 ecr 2184041091], length 0
12:55:46.501269 IP sravni-apigateway-service-566b9db658-f4d8g.80 > 10.244.7.1.33464: Flags [P.], seq 252:257, ack 128, win 219, options [nop,nop,TS val 2184041091 ecr 2184041091], length 5: HTTP
12:55:46.501302 IP 10.244.7.1.33464 > sravni-apigateway-service-566b9db658-f4d8g.80: Flags [.], ack 257, win 229, options [nop,nop,TS val 2184041091 ecr 2184041091], length 0
12:55:46.501408 IP 10.244.7.1.33464 > sravni-apigateway-service-566b9db658-f4d8g.80: Flags [F.], seq 128, ack 257, win 229, options [nop,nop,TS val 2184041091 ecr 2184041091], length 0
12:55:46.501579 IP sravni-apigateway-service-566b9db658-f4d8g.80 > 10.244.7.1.33464: Flags [F.], seq 257, ack 129, win 219, options [nop,nop,TS val 2184041091 ecr 2184041091], length 0
12:55:46.501610 IP 10.244.7.1.33464 > sravni-apigateway-service-566b9db658-f4d8g.80: Flags [.], ack 258, win 229, options [nop,nop,TS val 2184041091 ecr 2184041091], length 0
12:55:48.795828 IP sravni-apigateway-service-566b9db658-f4d8g.33840 > sravni-auto-service.master.svc.cluster.local.80: Flags [F.], seq 4252730808, ack 2714197396, win 235, options [nop,nop,TS val 2184041665 ecr 2228600884], length 0
12:55:48.795839 IP sravni-apigateway-service-566b9db658-f4d8g.49550 > sravni-osago-service.master.svc.cluster.local.80: Flags [F.], seq 616640501, ack 3532039755, win 238, options [nop,nop,TS val 2184041665 ecr 1089792811], length 0
12:55:48.796660 IP sravni-osago-service.master.svc.cluster.local.80 > sravni-apigateway-service-566b9db658-f4d8g.49550: Flags [F.], seq 1, ack 1, win 512, options [nop,nop,TS val 1089800267 ecr 2184041665], length 0
12:55:48.796693 IP sravni-apigateway-service-566b9db658-f4d8g.49550 > sravni-osago-service.master.svc.cluster.local.80: Flags [.], ack 2, win 238, options [nop,nop,TS val 2184041665 ecr 1089800267], length 0
12:55:48.798253 IP sravni-auto-service.master.svc.cluster.local.80 > sravni-apigateway-service-566b9db658-f4d8g.33840: Flags [F.], seq 1, ack 1, win 241, options [nop,nop,TS val 2228619525 ecr 2184041665], length 0
12:55:48.798290 IP sravni-apigateway-service-566b9db658-f4d8g.33840 > sravni-auto-service.master.svc.cluster.local.80: Flags [.], ack 2, win 235, options [nop,nop,TS val 2184041665 ecr 2228619525], length 0
12:55:48.867265 IP sravni-apigateway-service-566b9db658-f4d8g.38135 > kube-dns.kube-system.svc.cluster.local.53: 57740+ PTR? 89.84.107.10.in-addr.arpa. (43)
12:55:48.869026 IP kube-dns.kube-system.svc.cluster.local.53 > sravni-apigateway-service-566b9db658-f4d8g.38135: 57740 1/0/0 PTR sravni-auto-service.master.svc.cluster.local. (101)
12:55:48.869326 IP sravni-apigateway-service-566b9db658-f4d8g.43251 > kube-dns.kube-system.svc.cluster.local.53: 48267+ PTR? 242.225.111.10.in-addr.arpa. (45)
12:55:48.873748 IP kube-dns.kube-system.svc.cluster.local.53 > sravni-apigateway-service-566b9db658-f4d8g.43251: 48267 1/0/0 PTR sravni-osago-service.master.svc.cluster.local. (104)
12:55:49.244275 IP sravni-apigateway-service-566b9db658-f4d8g.33852 > sravni-auto-service.master.svc.cluster.local.80: Flags [F.], seq 2772002618, ack 3836126453, win 221, options [nop,nop,TS val 2184041777 ecr 2228600890], length 0
12:55:49.244842 IP sravni-apigateway-service-566b9db658-f4d8g.33850 > sravni-auto-service.master.svc.cluster.local.80: Flags [F.], seq 3110545486, ack 584889273, win 229, options [nop,nop,TS val 2184041777 ecr 2228600904], length 0
12:55:49.245123 IP sravni-apigateway-service-566b9db658-f4d8g.33848 > sravni-auto-service.master.svc.cluster.local.80: Flags [F.], seq 4126105580, ack 3855038171, win 276, options [nop,nop,TS val 2184041777 ecr 2228600904], length 0
12:55:49.246462 IP sravni-auto-service.master.svc.cluster.local.80 > sravni-apigateway-service-566b9db658-f4d8g.33848: Flags [F.], seq 1, ack 1, win 236, options [nop,nop,TS val 2228619637 ecr 2184041777], length 0
12:55:49.246491 IP sravni-apigateway-service-566b9db658-f4d8g.33848 > sravni-auto-service.master.svc.cluster.local.80: Flags [.], ack 2, win 276, options [nop,nop,TS val 2184041777 ecr 2228619637], length 0
12:55:49.246509 IP sravni-auto-service.master.svc.cluster.local.80 > sravni-apigateway-service-566b9db658-f4d8g.33850: Flags [F.], seq 1, ack 1, win 227, options [nop,nop,TS val 2228619637 ecr 2184041777], length 0
12:55:49.246541 IP sravni-apigateway-service-566b9db658-f4d8g.33850 > sravni-auto-service.master.svc.cluster.local.80: Flags [.], ack 2, win 229, options [nop,nop,TS val 2184041777 ecr 2228619637], length 0
12:55:49.246546 IP sravni-auto-service.master.svc.cluster.local.80 > sravni-apigateway-service-566b9db658-f4d8g.33852: Flags [F.], seq 1, ack 1, win 219, options [nop,nop,TS val 2228619637 ecr 2184041777], length 0
12:55:49.246569 IP sravni-apigateway-service-566b9db658-f4d8g.33852 > sravni-auto-service.master.svc.cluster.local.80: Flags [.], ack 2, win 221, options [nop,nop,TS val 2184041777 ecr 2228619637], length 0
12:55:52.653960 IP 10.244.2.170.33714 > sravni-apigateway-service-566b9db658-f4d8g.80: Flags [P.], seq 253:506, ack 106940, win 1846, options [nop,nop,TS val 287210374 ecr 2184038883], length 253: HTTP: GET /internal/metrics HTTP/1.1
12:55:52.664276 IP sravni-apigateway-service-566b9db658-f4d8g.80 > 10.244.2.170.33714: Flags [P.], seq 106940:108119, ack 506, win 1421, options [nop,nop,TS val 2184042632 ecr 287210374], length 1179: HTTP: HTTP/1.1 200 OK
12:55:52.664500 IP sravni-apigateway-service-566b9db658-f4d8g.80 > 10.244.2.170.33714: Flags [P.], seq 108119:111641, ack 506, win 1421, options [nop,nop,TS val 2184042632 ecr 287210374], length 3522: HTTP
12:55:52.664599 IP sravni-apigateway-service-566b9db658-f4d8g.80 > 10.244.2.170.33714: Flags [P.], seq 111641:113894, ack 506, win 1421, options [nop,nop,TS val 2184042632 ecr 287210374], length 2253: HTTP
12:55:52.664650 IP sravni-apigateway-service-566b9db658-f4d8g.80 > 10.244.2.170.33714: Flags [P.], seq 113894:114246, ack 506, win 1421, options [nop,nop,TS val 2184042632 ecr 287210374], length 352: HTTP
12:55:52.664712 IP sravni-apigateway-service-566b9db658-f4d8g.80 > 10.244.2.170.33714: Flags [P.], seq 114246:115545, ack 506, win 1421, options [nop,nop,TS val 2184042632 ecr 287210374], length 1299: HTTP
12:55:52.664754 IP sravni-apigateway-service-566b9db658-f4d8g.80 > 10.244.2.170.33714: Flags [P.], seq 115545:117136, ack 506, win 1421, options [nop,nop,TS val 2184042632 ecr 287210374], length 1591: HTTP
12:55:52.665012 IP 10.244.2.170.33714 > sravni-apigateway-service-566b9db658-f4d8g.80: Flags [.], ack 108119, win 1846, options [nop,nop,TS val 287210376 ecr 2184042632], length 0
12:55:52.665049 IP sravni-apigateway-service-566b9db658-f4d8g.80 > 10.244.2.170.33714: Flags [.], seq 117136:119932, ack 506, win 1421, options [nop,nop,TS val 2184042632 ecr 287210376], length 2796: HTTP
12:55:52.665118 IP 10.244.2.170.33714 > sravni-apigateway-service-566b9db658-f4d8g.80: Flags [.], ack 111641, win 1846, options [nop,nop,TS val 287210376 ecr 2184042632], length 0
12:55:52.665132 IP sravni-apigateway-service-566b9db658-f4d8g.80 > 10.244.2.170.33714: Flags [P.], seq 119932:120834, ack 506, win 1421, options [nop,nop,TS val 2184042632 ecr 287210376], length 902: HTTP
12:55:52.665239 IP 10.244.2.170.33714 > sravni-apigateway-service-566b9db658-f4d8g.80: Flags [.], ack 113894, win 1845, options [nop,nop,TS val 287210377 ecr 2184042632], length 0
12:55:52.665299 IP sravni-apigateway-service-566b9db658-f4d8g.80 > 10.244.2.170.33714: Flags [P.], seq 120834:121188, ack 506, win 1421, options [nop,nop,TS val 2184042632 ecr 287210377], length 354: HTTP
12:55:52.665364 IP sravni-apigateway-service-566b9db658-f4d8g.80 > 10.244.2.170.33714: Flags [P.], seq 121188:122329, ack 506, win 1421, options [nop,nop,TS val 2184042632 ecr 287210377], length 1141: HTTP
12:55:52.665371 IP 10.244.2.170.33714 > sravni-apigateway-service-566b9db658-f4d8g.80: Flags [.], ack 114246, win 1843, options [nop,nop,TS val 287210377 ecr 2184042632], length 0
12:55:52.665410 IP sravni-apigateway-service-566b9db658-f4d8g.80 > 10.244.2.170.33714: Flags [P.], seq 122329:122716, ack 506, win 1421, options [nop,nop,TS val 2184042632 ecr 287210377], length 387: HTTP
12:55:52.665422 IP 10.244.2.170.33714 > sravni-apigateway-service-566b9db658-f4d8g.80: Flags [.], ack 115545, win 1833, options [nop,nop,TS val 287210377 ecr 2184042632], length 0
12:55:52.665427 IP 10.244.2.170.33714 > sravni-apigateway-service-566b9db658-f4d8g.80: Flags [.], ack 117136, win 1821, options [nop,nop,TS val 287210377 ecr 2184042632], length 0
12:55:52.665453 IP sravni-apigateway-service-566b9db658-f4d8g.80 > 10.244.2.170.33714: Flags [P.], seq 122716:122843, ack 506, win 1421, options [nop,nop,TS val 2184042632 ecr 287210377], length 127: HTTP
12:55:52.665523 IP sravni-apigateway-service-566b9db658-f4d8g.80 > 10.244.2.170.33714: Flags [P.], seq 122843:123781, ack 506, win 1421, options [nop,nop,TS val 2184042632 ecr 287210377], length 938: HTTP
12:55:52.665577 IP sravni-apigateway-service-566b9db658-f4d8g.80 > 10.244.2.170.33714: Flags [P.], seq 123781:125031, ack 506, win 1421, options [nop,nop,TS val 2184042632 ecr 287210377], length 1250: HTTP
12:55:52.665624 IP sravni-apigateway-service-566b9db658-f4d8g.80 > 10.244.2.170.33714: Flags [P.], seq 125031:126128, ack 506, win 1421, options [nop,nop,TS val 2184042632 ecr 287210377], length 1097: HTTP
12:55:52.665678 IP sravni-apigateway-service-566b9db658-f4d8g.80 > 10.244.2.170.33714: Flags [P.], seq 126128:127332, ack 506, win 1421, options [nop,nop,TS val 2184042632 ecr 287210377], length 1204: HTTP
12:55:52.665746 IP sravni-apigateway-service-566b9db658-f4d8g.80 > 10.244.2.170.33714: Flags [P.], seq 127332:128581, ack 506, win 1421, options [nop,nop,TS val 2184042632 ecr 287210377], length 1249: HTTP
12:55:52.665792 IP sravni-apigateway-service-566b9db658-f4d8g.80 > 10.244.2.170.33714: Flags [P.], seq 128581:129826, ack 506, win 1421, options [nop,nop,TS val 2184042632 ecr 287210377], length 1245: HTTP
12:55:52.665832 IP sravni-apigateway-service-566b9db658-f4d8g.80 > 10.244.2.170.33714: Flags [P.], seq 129826:130829, ack 506, win 1421, options [nop,nop,TS val 2184042632 ecr 287210377], length 1003: HTTP
12:55:52.665897 IP sravni-apigateway-service-566b9db658-f4d8g.80 > 10.244.2.170.33714: Flags [P.], seq 130829:131785, ack 506, win 1421, options [nop,nop,TS val 2184042632 ecr 287210377], length 956: HTTP
12:55:52.666458 IP 10.244.2.170.33714 > sravni-apigateway-service-566b9db658-f4d8g.80: Flags [.], ack 120834, win 1793, options [nop,nop,TS val 287210377 ecr 2184042632], length 0
12:55:52.666475 IP sravni-apigateway-service-566b9db658-f4d8g.80 > 10.244.2.170.33714: Flags [P.], seq 131785:142143, ack 506, win 1421, options [nop,nop,TS val 2184042632 ecr 287210377], length 10358: HTTP
12:55:52.666477 IP 10.244.2.170.33714 > sravni-apigateway-service-566b9db658-f4d8g.80: Flags [.], ack 121188, win 1791, options [nop,nop,TS val 287210377 ecr 2184042632], length 0
12:55:52.666481 IP 10.244.2.170.33714 > sravni-apigateway-service-566b9db658-f4d8g.80: Flags [.], ack 122329, win 1783, options [nop,nop,TS val 287210377 ecr 2184042632], length 0
12:55:52.666483 IP 10.244.2.170.33714 > sravni-apigateway-service-566b9db658-f4d8g.80: Flags [.], ack 122716, win 1780, options [nop,nop,TS val 287210377 ecr 2184042632], length 0
12:55:52.666486 IP 10.244.2.170.33714 > sravni-apigateway-service-566b9db658-f4d8g.80: Flags [.], ack 122843, win 1780, options [nop,nop,TS val 287210377 ecr 2184042632], length 0
12:55:52.666488 IP 10.244.2.170.33714 > sravni-apigateway-service-566b9db658-f4d8g.80: Flags [.], ack 123781, win 1773, options [nop,nop,TS val 287210377 ecr 2184042632], length 0
12:55:52.666491 IP 10.244.2.170.33714 > sravni-apigateway-service-566b9db658-f4d8g.80: Flags [.], ack 125031, win 1764, options [nop,nop,TS val 287210377 ecr 2184042632], length 0
12:55:52.666494 IP 10.244.2.170.33714 > sravni-apigateway-service-566b9db658-f4d8g.80: Flags [.], ack 126128, win 1756, options [nop,nop,TS val 287210377 ecr 2184042632], length 0
12:55:52.666627 IP sravni-apigateway-service-566b9db658-f4d8g.80 > 10.244.2.170.33714: Flags [P.], seq 142143:144434, ack 506, win 1421, options [nop,nop,TS val 2184042632 ecr 287210377], length 2291: HTTP
12:55:52.666708 IP sravni-apigateway-service-566b9db658-f4d8g.80 > 10.244.2.170.33714: Flags [P.], seq 144434:149581, ack 506, win 1421, options [nop,nop,TS val 2184042632 ecr 287210377], length 5147: HTTP
12:55:52.666757 IP sravni-apigateway-service-566b9db658-f4d8g.80 > 10.244.2.170.33714: Flags [P.], seq 149581:152275, ack 506, win 1421, options [nop,nop,TS val 2184042632 ecr 287210377], length 2694: HTTP
12:55:52.666977 IP sravni-apigateway-service-566b9db658-f4d8g.80 > 10.244.2.170.33714: Flags [P.], seq 152275:157333, ack 506, win 1421, options [nop,nop,TS val 2184042633 ecr 287210377], length 5058: HTTP
12:55:52.667409 IP 10.244.2.170.33714 > sravni-apigateway-service-566b9db658-f4d8g.80: Flags [.], ack 127332, win 1747, options [nop,nop,TS val 287210377 ecr 2184042632], length 0
12:55:52.667422 IP 10.244.2.170.33714 > sravni-apigateway-service-566b9db658-f4d8g.80: Flags [.], ack 128581, win 1738, options [nop,nop,TS val 287210377 ecr 2184042632], length 0
12:55:52.667426 IP 10.244.2.170.33714 > sravni-apigateway-service-566b9db658-f4d8g.80: Flags [.], ack 131785, win 1718, options [nop,nop,TS val 287210377 ecr 2184042632], length 0
12:55:52.667438 IP sravni-apigateway-service-566b9db658-f4d8g.80 > 10.244.2.170.33714: Flags [P.], seq 157333:168290, ack 506, win 1421, options [nop,nop,TS val 2184042633 ecr 287210377], length 10957: HTTP
12:55:52.667488 IP 10.244.2.170.33714 > sravni-apigateway-service-566b9db658-f4d8g.80: Flags [.], ack 134581, win 1798, options [nop,nop,TS val 287210377 ecr 2184042632], length 0
12:55:52.667492 IP 10.244.2.170.33714 > sravni-apigateway-service-566b9db658-f4d8g.80: Flags [.], ack 142143, win 1822, options [nop,nop,TS val 287210377 ecr 2184042632], length 0
12:55:52.667548 IP sravni-apigateway-service-566b9db658-f4d8g.80 > 10.244.2.170.33714: Flags [P.], seq 168290:169701, ack 506, win 1421, options [nop,nop,TS val 2184042633 ecr 287210377], length 1411: HTTP
12:55:52.667604 IP sravni-apigateway-service-566b9db658-f4d8g.80 > 10.244.2.170.33714: Flags [P.], seq 169701:172822, ack 506, win 1421, options [nop,nop,TS val 2184042633 ecr 287210377], length 3121: HTTP
12:55:52.667646 IP sravni-apigateway-service-566b9db658-f4d8g.80 > 10.244.2.170.33714: Flags [P.], seq 172822:175406, ack 506, win 1421, options [nop,nop,TS val 2184042633 ecr 287210377], length 2584: HTTP
12:55:52.667686 IP sravni-apigateway-service-566b9db658-f4d8g.80 > 10.244.2.170.33714: Flags [P.], seq 175406:177325, ack 506, win 1421, options [nop,nop,TS val 2184042633 ecr 287210377], length 1919: HTTP
12:55:52.667798 IP 10.244.2.170.33714 > sravni-apigateway-service-566b9db658-f4d8g.80: Flags [.], ack 153673, win 1828, options [nop,nop,TS val 287210377 ecr 2184042632], length 0
12:55:52.667806 IP sravni-apigateway-service-566b9db658-f4d8g.80 > 10.244.2.170.33714: Flags [P.], seq 177325:181815, ack 506, win 1421, options [nop,nop,TS val 2184042633 ecr 287210377], length 4490: HTTP
12:55:52.667807 IP 10.244.2.170.33714 > sravni-apigateway-service-566b9db658-f4d8g.80: Flags [.], ack 156469, win 1811, options [nop,nop,TS val 287210377 ecr 2184042633], length 0
12:55:52.667882 IP sravni-apigateway-service-566b9db658-f4d8g.80 > 10.244.2.170.33714: Flags [P.], seq 181815:183574, ack 506, win 1421, options [nop,nop,TS val 2184042633 ecr 287210377], length 1759: HTTP
12:55:52.667938 IP sravni-apigateway-service-566b9db658-f4d8g.80 > 10.244.2.170.33714: Flags [P.], seq 183574:186821, ack 506, win 1421, options [nop,nop,TS val 2184042633 ecr 287210377], length 3247: HTTP
12:55:52.667982 IP sravni-apigateway-service-566b9db658-f4d8g.80 > 10.244.2.170.33714: Flags [P.], seq 186821:188980, ack 506, win 1421, options [nop,nop,TS val 2184042633 ecr 287210377], length 2159: HTTP
12:55:52.668022 IP sravni-apigateway-service-566b9db658-f4d8g.80 > 10.244.2.170.33714: Flags [P.], seq 188980:191144, ack 506, win 1421, options [nop,nop,TS val 2184042633 ecr 287210377], length 2164: HTTP
12:55:52.668079 IP sravni-apigateway-service-566b9db658-f4d8g.80 > 10.244.2.170.33714: Flags [P.], seq 191144:193086, ack 506, win 1421, options [nop,nop,TS val 2184042633 ecr 287210377], length 1942: HTTP
12:55:52.668117 IP sravni-apigateway-service-566b9db658-f4d8g.80 > 10.244.2.170.33714: Flags [P.], seq 193086:193504, ack 506, win 1421, options [nop,nop,TS val 2184042633 ecr 287210377], length 418: HTTP
12:55:52.668162 IP sravni-apigateway-service-566b9db658-f4d8g.80 > 10.244.2.170.33714: Flags [P.], seq 193504:195078, ack 506, win 1421, options [nop,nop,TS val 2184042633 ecr 287210377], length 1574: HTTP
12:55:52.668198 IP sravni-apigateway-service-566b9db658-f4d8g.80 > 10.244.2.170.33714: Flags [P.], seq 195078:196444, ack 506, win 1421, options [nop,nop,TS val 2184042633 ecr 287210377], length 1366: HTTP
12:55:52.668712 IP 10.244.2.170.33714 > sravni-apigateway-service-566b9db658-f4d8g.80: Flags [.], ack 157333, win 1846, options [nop,nop,TS val 287210377 ecr 2184042633], length 0
12:55:52.668733 IP sravni-apigateway-service-566b9db658-f4d8g.80 > 10.244.2.170.33714: Flags [P.], seq 196444:210539, ack 506, win 1421, options [nop,nop,TS val 2184042633 ecr 287210377], length 14095: HTTP
12:55:52.668735 IP 10.244.2.170.33714 > sravni-apigateway-service-566b9db658-f4d8g.80: Flags [.], ack 168290, win 1846, options [nop,nop,TS val 287210377 ecr 2184042633], length 0
12:55:52.668842 IP sravni-apigateway-service-566b9db658-f4d8g.80 > 10.244.2.170.33714: Flags [P.], seq 210539:211313, ack 506, win 1421, options [nop,nop,TS val 2184042633 ecr 287210377], length 774: HTTP
12:55:52.668892 IP sravni-apigateway-service-566b9db658-f4d8g.80 > 10.244.2.170.33714: Flags [P.], seq 211313:213086, ack 506, win 1421, options [nop,nop,TS val 2184042633 ecr 287210377], length 1773: HTTP
12:55:52.668946 IP sravni-apigateway-service-566b9db658-f4d8g.80 > 10.244.2.170.33714: Flags [P.], seq 213086:213874, ack 506, win 1421, options [nop,nop,TS val 2184042633 ecr 287210377], length 788: HTTP
12:55:52.669225 IP sravni-apigateway-service-566b9db658-f4d8g.80 > 10.244.2.170.33714: Flags [P.], seq 213874:213879, ack 506, win 1421, options [nop,nop,TS val 2184042633 ecr 287210377], length 5: HTTP
12:55:52.678915 IP sravni-apigateway-service-566b9db658-f4d8g.80 > 10.244.2.170.33714: Flags [P.], seq 213874:213879, ack 506, win 1421, options [nop,nop,TS val 2184042636 ecr 287210377], length 5: HTTP
12:55:52.679531 IP 10.244.2.170.33714 > sravni-apigateway-service-566b9db658-f4d8g.80: Flags [.], ack 213879, win 1497, options [nop,nop,TS val 287210380 ecr 2184042633,nop,nop,sack 1 {213874:213879}], length 0
12:55:54.880166 IP 10.244.7.1.33604 > sravni-apigateway-service-566b9db658-f4d8g.80: Flags [S], seq 1129048538, win 28200, options [mss 1410,sackOK,TS val 2184043186 ecr 0,nop,wscale 7], length 0
12:55:54.880232 IP sravni-apigateway-service-566b9db658-f4d8g.80 > 10.244.7.1.33604: Flags [S.], seq 3021061034, ack 1129048539, win 27960, options [mss 1410,sackOK,TS val 2184043186 ecr 2184043186,nop,wscale 7], length 0
12:55:54.880266 IP 10.244.7.1.33604 > sravni-apigateway-service-566b9db658-f4d8g.80: Flags [.], ack 1, win 221, options [nop,nop,TS val 2184043186 ecr 2184043186], length 0
12:55:54.880474 IP 10.244.7.1.33604 > sravni-apigateway-service-566b9db658-f4d8g.80: Flags [P.], seq 1:126, ack 1, win 221, options [nop,nop,TS val 2184043186 ecr 2184043186], length 125: HTTP: GET /internal/ping HTTP/1.1
12:55:54.880484 IP sravni-apigateway-service-566b9db658-f4d8g.80 > 10.244.7.1.33604: Flags [.], ack 126, win 219, options [nop,nop,TS val 2184043186 ecr 2184043186], length 0
12:55:54.882059 IP sravni-apigateway-service-566b9db658-f4d8g.80 > 10.244.7.1.33604: Flags [P.], seq 1:238, ack 126, win 219, options [nop,nop,TS val 2184043186 ecr 2184043186], length 237: HTTP: HTTP/1.1 200 OK
12:55:54.882128 IP 10.244.7.1.33604 > sravni-apigateway-service-566b9db658-f4d8g.80: Flags [.], ack 238, win 229, options [nop,nop,TS val 2184043186 ecr 2184043186], length 0
